{
  "id": 2728,
  "designation": "ГОСТ 24297-87",
  "designation_kind": "GOST",
  "title_ru": "Входной контроль продукции. Основные положения",
  "title_en": "Input inspection of products. General",
  "status": "replaced",
  "status_label_ru": "Заменен",
  "effective_from": "1988-01-01",
  "limited_until": "2014-01-01",
  "standard_kind": "4 - Стандарты на методы контроля",
  "requirement_kind": "Документ имеет отметку *",
  "developer_org": "Госкомитет СССР по стандартам",
  "introduced_by_cis_org": "Госкомитет СССР по стандартам",
  "mnd_developer": "Российская Федерация",
  "rostekh_department": "530 - Отдел стандартизации и сертификации информационных технологий, продукции электротехники и приборостроения",
  "last_edition_date": "2009-05-01",
  "amendment_notes": "переиздание",
  "page_count": 8,
  "abstract": "Настоящий стандарт устанавливает основные положения по организации, проведению и оформлению результатов входного контроля сырья, материалов, полуфабрикатов и комплектующих изделий, используемых для изготовления продукции.",
  "keywords": [
    "входной контроль продукции",
    "разработка",
    "производство",
    "эксплуатация и ремонт промышленной продукции"
  ],
  "classifiers": [
    {
      "system": "OKS",
      "path": ["03", "03.120", "03.120.10"],
      "current_code": "03.120.10",
      "labels": [
        "Социология. Услуги. Организация фирм и управление ими. Администрация. Транспорт",
        "Качество",
        "Управление качеством и обеспечение качества"
      ]
    },
    {
      "system": "KGS",
      "path": ["Т", "Т5", "Т51"],
      "current_code": "Т51",
      "labels": [
        "Общетехнические и организационно-методические стандарты",
        "Система документации",
        "Система документации, определяющая показатели качества, надежности и долговечности продукции"
      ]
    },
    {
      "system": "OKSTU",
      "path": ["0000", "0025"],
      "current_code": "0025",
      "labels": [
        "СИСТЕМЫ ОБЩЕТЕХНИЧЕСКИХ И ОРГАНИЗАЦИОННО-МЕТОДИЧЕСКИХ СТАНДАРТОВ",
        "Единая система Государственного управления качеством продукции (ЕСГУКП)"
      ]
    },
    {
      "system": "GRNTI",
      "path": ["81", "81.81", "81.81.05"],
      "current_code": "81.81.05",
      "labels": [
        "ОБЩИЕ И КОМПЛЕКСНЫЕ ПРОБЛЕМЫ ТЕХНИЧЕСКИХ И ПРИКЛАДНЫХ НАУК И ОТРАСЛЕЙ НАРОДНОГО ХОЗЯЙСТВА",
        "Контроль и управление качеством",
        "Системы управления качеством"
      ]
    }
  ],
  "relations": [
    {
      "type": "replaced_by",
      "to_id": 52077,
      "to_designation": "ГОСТ 24297-2013",
      "to_title_ru": "Верификация закупленной продукции. Организация проведения и методы контроля",
      "to_status_marker": "Д"
    },
    {
      "type": "normative_ref_gost",
      "to_id": 5187,
      "to_designation": "ГОСТ 2.124-85",
      "to_status_marker": "З"
    }
  ],
  "source_url": "https://www.pntd.ru/nd/2728.html"
}
