{
  "id": 23446,
  "designation": "ГОСТ 12.1.004-91",
  "designation_kind": "GOST",
  "title_ru": "Система стандартов безопасности труда. Пожарная безопасность. Общие требования",
  "title_en": "Occupational safety standards system. Fire safety. General requirements",
  "status": "active",
  "status_label_ru": "Действует",
  "effective_from": "1992-07-01",
  "standard_kind": "1 - Основополагающие стандарты",
  "requirement_kind": "Требования для сертификации",
  "developer_org": "МВД СССР; Минхимпром СССР",
  "mnd_developer": "Российская Федерация",
  "rostekh_department": "510 - Научно-техническое управление",
  "interstate_tc": "274 - Пожарная безопасность",
  "tc_number": "274",
  "tc_assignment_order_number": "147",
  "tc_assignment_order_date": "2023-01-26",
  "last_edition_date": "2006-09-01",
  "amendment_notes": "переиздание с изм. 1",
  "page_count": 68,
  "abstract": "Настоящий стандарт устанавливает общие требования пожарной безопасности к объектам защиты различного назначения на всех стадиях их жизненного цикла.",
  "keywords": ["пожарная безопасность", "охрана"],
  "terms_note": "Приложение",
  "classifiers": [],
  "relations": [],
  "source_url": "https://www.pntd.ru/nd/23446.html"
}
